{
  "version": 1,
  "task_id": "example-province-switch",
  "task": "Example province switch behavior",
  "risk_level": "low",
  "claims": [
    {
      "id": "EV-PROVINCE-SWITCH",
      "claim": "Displayed data follows the newly selected province.",
      "required": true,
      "status": "pass",
      "evidence": [
        {
          "kind": "manual",
          "provenance": "manual",
          "ref": "example human confirmation",
          "note": "Static framework example only; medium/high required pass claims need current workspace-bound pact-run Evidence."
        }
      ]
    },
    {
      "id": "EV-PROVINCE-REFRESH",
      "claim": "The expected province state remains correct after refresh.",
      "required": true,
      "status": "pass",
      "evidence": [
        {
          "kind": "manual",
          "provenance": "manual",
          "ref": "example human confirmation"
        }
      ]
    }
  ],
  "limitations": []
}
